Clinic Name,Location,Established,Specializations,Key Services,Target Client,Contact/Website
Aesthetics International,Dubai (Multiple locations),2010s,"Plastic Surgery, Dermatology","Botox, Fillers, Thread lifts, Laser",High-end clientele,aesthetics.ae
Skin111 Clinic,Dubai Healthcare City,2010s,"Medical Aesthetics, IV Therapy","Botox, Dermal fillers, PRP, Mesotherapy",Wellness-focused clients,skin111.com
Lucia Clinic,Dubai (DIFC area),2010s,Advanced Aesthetics,"Custom injectables, Anti-aging, Rejuvenation",Luxury market,luciaclinic.com
Enhance by Mediclinic,Dubai (Multiple locations),2020s,Comprehensive Aesthetics,"Botox, Fillers, Body contouring, Dermatology",International clientele,enhancebymediclinic.ae
Aesthetic Clinic,Abu Dhabi (Multiple),2010s,Full-service Aesthetics,"Plastic surgery, Laser, Injectables",Premium clients,aestheticclinic.ae
Emirates Dermatology Centre (EDCC),Abu Dhabi,Est. by Dr. Mouza Al Suwaidi,"Dermatology, Cosmetology","FDA-approved treatments, Injectables",Local/expat mix,edcc.ae
AEON Clinic,Dubai,2020s,Regenerative Medicine,"Anti-aging, Longevity treatments, Advanced injectables",Ultra-high-end,aeon-clinic.com
BHWAA Clinic,Dubai/Beverly Hills,2010s,International Standards,"Wellness & aesthetics fusion, Premium injectables",International clientele,bhwaa.com
